{
  "$schema": "../schema/product-definition.schema.json",
  "id": "printed_notebooks",
  "name": "Printed Notebooks",
  "family": "pen",
  "type": "Notebook",
  "group": "notebook",
  "status": "live",
  "studio_status": "planned",
  "bigcommerce": {
    "product_id": 132,
    "url": "/notebooks/printed-notebooks/",
    "sku": "51N0199999",
    "base_variant_id": null,
    "template": "penprod"
  },
  "size": {
    "mode": "fixed",
    "unit": "in",
    "w_in": null,
    "h_in": null
  },
  "product_colors": [
    "Grey",
    "Blue",
    "Black"
  ],
  "decoration": "printed",
  "text_fields": [
    "text_1",
    "text_2"
  ],
  "fonts": [
    "Alegreya",
    "Anton",
    "Archivo Black",
    "Bebas Neue",
    "Homemade Apple",
    "Josefin Sans",
    "Lato",
    "Libre Baskerville",
    "Montserrat",
    "Oswald"
  ],
  "personalization": null,
  "quantity": {
    "min": null,
    "max": null
  },
  "pricing": {
    "source": "bigcommerce_variants",
    "pulled_at": "2026-10-11T01:00:26.076Z",
    "base_price": 19.56,
    "quantity_tiers": [
      {
        "min_qty": 10,
        "max_qty": 24,
        "type": "percent",
        "amount": 10
      },
      {
        "min_qty": 25,
        "max_qty": 49,
        "type": "percent",
        "amount": 15
      },
      {
        "min_qty": 50,
        "max_qty": 99,
        "type": "percent",
        "amount": 20
      },
      {
        "min_qty": 100,
        "max_qty": 149,
        "type": "percent",
        "amount": 25
      },
      {
        "min_qty": 150,
        "max_qty": 249,
        "type": "percent",
        "amount": 30
      },
      {
        "min_qty": 250,
        "max_qty": 499,
        "type": "percent",
        "amount": 35
      },
      {
        "min_qty": 500,
        "max_qty": 999,
        "type": "percent",
        "amount": 40
      },
      {
        "min_qty": 1000,
        "max_qty": 4999,
        "type": "percent",
        "amount": 45
      },
      {
        "min_qty": 5000,
        "max_qty": null,
        "type": "percent",
        "amount": 50
      }
    ],
    "variants": [
      {
        "id": 147,
        "sku": "51N0199999020",
        "price": 19.56,
        "purchasing_disabled": true,
        "options": {
          "notebook_color": "Grey"
        }
      },
      {
        "id": 148,
        "sku": "51N0199999016",
        "price": 19.56,
        "purchasing_disabled": true,
        "options": {
          "notebook_color": "Blue"
        }
      },
      {
        "id": 149,
        "sku": "51N0199999001",
        "price": 19.56,
        "purchasing_disabled": true,
        "options": {
          "notebook_color": "Black"
        }
      }
    ]
  },
  "editor": {
    "mode": "imprint",
    "fields": [
      "text_1",
      "text_2",
      "logo"
    ],
    "layouts": "BigCommerce 'Select Layout' modifier (layout1 to layout8)",
    "genie": true
  },
  "checks": null,
  "previews": [
    "flat",
    "scene:product_model"
  ],
  "cart": {
    "note": "BigCommerce options pick the variant (price); modifiers carry the design. These are the fields the Doogma builder fills today.",
    "options": [
      {
        "id": 136,
        "name": "Notebook Color",
        "role": "notebook_color"
      }
    ],
    "modifiers": [
      {
        "id": 610,
        "name": "Image",
        "type": "text",
        "required": false,
        "role": "image"
      },
      {
        "id": 612,
        "name": "Text",
        "type": "text",
        "required": false,
        "role": "text_1"
      },
      {
        "id": 613,
        "name": "Alignment",
        "type": "swatch",
        "required": false,
        "role": "alignment",
        "values": [
          {
            "id": 903,
            "label": "left"
          },
          {
            "id": 904,
            "label": "center"
          },
          {
            "id": 905,
            "label": "right"
          }
        ]
      },
      {
        "id": 614,
        "name": "Color",
        "type": "text",
        "required": false,
        "role": "ink_color"
      },
      {
        "id": 615,
        "name": "Special Design Instructions",
        "type": "text",
        "required": false,
        "role": "special_instructions"
      },
      {
        "id": 1111,
        "name": "Font1",
        "type": "swatch",
        "required": false,
        "role": "font_1",
        "values": [
          {
            "id": 1316,
            "label": "Alegreya"
          },
          {
            "id": 1317,
            "label": "Anton"
          },
          {
            "id": 1318,
            "label": "Archivo Black"
          },
          {
            "id": 1319,
            "label": "Bebas Neue"
          },
          {
            "id": 1320,
            "label": "Homemade Apple"
          },
          {
            "id": 1321,
            "label": "Josefin Sans"
          },
          {
            "id": 1322,
            "label": "Lato"
          },
          {
            "id": 1323,
            "label": "Libre Baskerville"
          },
          {
            "id": 1324,
            "label": "Montserrat"
          },
          {
            "id": 1325,
            "label": "Oswald"
          }
        ]
      },
      {
        "id": 1112,
        "name": "Text Line 2",
        "type": "text",
        "required": false,
        "role": "text_2"
      },
      {
        "id": 1113,
        "name": "Review",
        "type": "checkbox",
        "required": true,
        "role": "proof_approval",
        "values": [
          {
            "id": 1336,
            "label": "Yes"
          },
          {
            "id": 1337,
            "label": "No"
          }
        ]
      },
      {
        "id": 1114,
        "name": "Saved Design",
        "type": "text",
        "required": false,
        "role": "saved_design"
      },
      {
        "id": 1115,
        "name": "Saved Design Link",
        "type": "text",
        "required": false,
        "role": "saved_design_link"
      },
      {
        "id": 1116,
        "name": "Saved Print Output",
        "type": "text",
        "required": true,
        "role": "saved_print_output"
      },
      {
        "id": 1117,
        "name": "Size",
        "type": "text",
        "required": false,
        "role": "size_field"
      },
      {
        "id": 1303,
        "name": "Select Layout",
        "type": "swatch",
        "required": true,
        "role": "layout",
        "values": [
          {
            "id": 1379,
            "label": "layout1"
          },
          {
            "id": 1380,
            "label": "layout2"
          },
          {
            "id": 1381,
            "label": "layout3"
          },
          {
            "id": 1382,
            "label": "layout4"
          },
          {
            "id": 1383,
            "label": "layout5"
          },
          {
            "id": 1384,
            "label": "layout6"
          },
          {
            "id": 1385,
            "label": "layout7"
          },
          {
            "id": 1386,
            "label": "layout8"
          }
        ]
      },
      {
        "id": 2129,
        "name": "Uploaded Logo Size",
        "type": "text",
        "required": false,
        "role": "logo_size"
      },
      {
        "id": 2231,
        "name": "Font1size",
        "type": "text",
        "required": false,
        "role": "font_1_size"
      },
      {
        "id": 2232,
        "name": "Font2size",
        "type": "text",
        "required": false,
        "role": "font_2_size"
      }
    ],
    "required_modifiers": [
      "Review",
      "Saved Print Output",
      "Select Layout"
    ]
  },
  "mcp": {
    "product_id": "printed_notebooks",
    "studio_supported": false
  },
  "assumptions": [
    "Decoration (engraved or printed) comes from the BigCommerce custom field dp_engraved.",
    "'scene:product_model' means a picture of the actual pen or notebook model in the chosen color; still to be built."
  ],
  "todo": [
    "Imprint area (width x height) and position for every pen model and the notebook.",
    "Ink colors allowed per model and method (printed vs engraved), and the color limit.",
    "Production file format for imprints.",
    "Imprint area for this model (see family todo)."
  ]
}
